{
  "name": "OctoCoach",
  "email": "info@octo.coach",
  "address": {
    "street": "Mulvanystraße",
    "number": 2,
    "city": "Düsseldorf",
    "postalCode": 40239
  },
  "website": "https://octo.coach",
  "phone": "+49 176 5537 5225",
  "subjectAreas": {
    "fb1": true,
    "fb2": false,
    "fb3": false,
    "fb4": false,
    "fb5": false,
    "fb6": false
  },
  "employees": {
    "fullTime": 1,
    "partTime": 0,
    "external": 0
  },
  "head": {
    "firstName": "Adriaan",
    "lastName": "van der Bergh",
    "email": "adriaan@octo.coach",
    "phone": "+49 176 5537 5225",
    "birthYear": 1981,
    "birthPlace": "Kempton Park, Südafrika",
    "positionStart": 2023,
    "qualifications": [
      {
        "institution": "University of South Africa",
        "qualification": "Bachelor of Education (B.Ed)",
        "completionYear": 2008
      },
      {
        "institution": "Endicott College",
        "qualification": "Master of Education (M.Ed)",
        "completionYear": 2014
      }
    ],
    "experience": [
      {
        "institution": "SuperCode GmbH & Co. KG",
        "type": "Vollzeitbeschäftigung",
        "description": "Trainer für Webentwicklung",
        "startDate": "2020-01-01T00:00:00+01:00",
        "endDate": "2020-12-31T00:00:00+01:00"
      },
      {
        "institution": "International School of Düsseldorf e.V.",
        "type": "Vollzeitbeschäftigung",
        "description": "Technologie-Integrations-Coach für Lehrkräfte",
        "startDate": "2011-01-01T00:00:00+01:00",
        "endDate": "2019-12-31T00:00:00+01:00"
      }
    ]
  },
  "measures": {
    "fb1": true,
    "fb4": false
  },
  "$schema": "../schema.json"
}
